{
  "phase": "COMPLETION",
  "intent": "review",
  "job_name": "review--dm-object-type-hierarchy",
  "create_pr": false,
  "context": {
    "project_dir": "/home/altsay/work/vantage-frontend",
    "base_branch": "develop",
    "branch": "refactor/dm-object-type-hierarchy-prd"
  },
  "plan": {
    "steps": [
      { "id": "context", "type": "context", "agent": "context-collector", "depends": [], "status": "skipped" },
      { "id": "review-ai", "type": "review", "agent": "code-ai-review", "depends": [], "status": "completed" },
      { "id": "review-style", "type": "review", "agent": "code-style-review", "depends": [], "status": "completed" },
      { "id": "review-mobx", "type": "review", "agent": "code-mobx-store-review", "depends": [], "status": "completed" },
      { "id": "report", "type": "report", "agent": "orchestrator", "depends": ["review-ai", "review-style", "review-mobx"], "status": "completed" }
    ],
    "current_step": "report"
  }
}
